{
  "$schema": "http://json-schema.org/draft-07/schema#",
  "$id": "https://w-model-dev/schemas/rtm.schema.json",
  "title": "RTMMatrixShape",
  "description": "需求追溯矩阵（RTM）结构 schema，对应 gate-logic.ts RTMMatrixShape",
  "type": "object",
  "additionalProperties": false,
  "required": ["rows", "executionSummary"],
  "properties": {
    "schemaVersion": {
      "description": "RTM schema 版本标识（与 gate-logic.ts RTMMatrixShape 对齐）",
      "type": "string"
    },
    "projectId": {
      "description": "项目 ID（与 project.json 的 id 一致）",
      "type": "string"
    },
    "currentPhase": {
      "description": "当前所处阶段编号，取值 1-8（1=需求分析 … 8=验收测试；阶段门放行后推进）",
      "type": "integer",
      "minimum": 1,
      "maximum": 8
    },
    "lastUpdated": {
      "description": "RTM 最后更新时间，ISO 8601 字符串（每次回填后刷新）",
      "type": "string"
    },
    "rows": {
      "description": "需求追溯行数组，每行对应一个需求（REQ-NNN / NFR-NNN / CON-NNN）的追溯记录；约束 #3：S 子代理产出后每阶段必须回填",
      "type": "array",
      "items": {
        "description": "单条需求追溯行（RtmRow：需求 ID + 各阶段产物引用 + 覆盖状态）",
        "type": "object",
        "additionalProperties": false,
        "required": [
          "requirementId",
          "description",
          "designDoc",
          "codeModule",
          "unitTest",
          "integrationTest",
          "systemTest",
          "acceptanceTest"
        ],
        "properties": {
          "requirementId": {
            "description": "需求 ID，格式 REQ-NNN / NFR-NNN / CON-NNN，须唯一（重复触发门禁报错）",
            "type": "string",
            "minLength": 1
          },
          "description": {
            "description": "需求描述文本；阶段 1 需求登记时填写，可空（允许 null）",
            "type": ["string", "null"]
          },
          "designDoc": {
            "description": "设计文档引用：阶段 2 填系统设计 SD-N.N.N、阶段 3 补接口设计、阶段 4 补详细设计；可空（允许 null）",
            "type": ["string", "null"]
          },
          "codeModule": {
            "description": "代码模块映射锚点。REQ 行条目格式 `SD-<id>:src/<path>:L<start>[-<end>]`（如 `SD-5.2.1:src/auth/login.ts:L42-58`），NFR/CON 行条目 `src/<path>:L<start>[-<end>]`，单格逗号分隔多条目，NFR/CON 允许整格 `横切`。行号须落在文件总行数内（门禁 SDMAP 校验）。",
            "type": ["string", "null"]
          },
          "unitTest": {
            "description": "单元测试用例 ID（UT-NNN）：阶段 4 设计登记、阶段 5 执行回填；可空（允许 null）",
            "type": ["string", "null"]
          },
          "integrationTest": {
            "description": "集成测试用例 ID（IT-NNN）：阶段 3 设计登记、阶段 6 执行回填；可空（允许 null）",
            "type": ["string", "null"]
          },
          "systemTest": {
            "description": "系统测试用例 ID（ST-NNN）：阶段 2 设计登记、阶段 7 执行回填；可空（允许 null）",
            "type": ["string", "null"]
          },
          "acceptanceTest": {
            "description": "验收测试用例 ID（UAT-NNN）：阶段 1 设计登记、阶段 8 执行回填；可空（允许 null）",
            "type": ["string", "null"]
          },
          "coverageStatus": {
            "description": "覆盖率状态：\"100%\"=该行追溯完整（全部行完整时矩阵 coveragePercent=100）；\"部分\"=该行存在追溯缺失（coveragePercent 须<100）；\"待覆盖\"=违反约束 #3，不允许（须回退重做）",
            "type": "string"
          },
          "targetValue": {
            "type": "string",
            "description": "NFR 生产目标值（NFR 类型时推荐填写）"
          },
          "testThreshold": {
            "type": "string",
            "description": "NFR 测试环境基线（NFR 类型时推荐填写）"
          }
        }
      }
    },
    "executionSummary": {
      "description": "四级测试执行汇总（单元/集成/系统/验收），对应门禁 check-artifact-gate.ts 的四级测试校验（按阶段递进校验层）",
      "type": "object",
      "additionalProperties": false,
      "required": ["unitTest", "integrationTest", "systemTest", "acceptanceTest"],
      "properties": {
        "unitTest": {
          "description": "单元测试执行汇总（阶段 5 起校验；覆盖率须 ≥80%）",
          "$ref": "#/definitions/testSummary"
        },
        "integrationTest": {
          "description": "集成测试执行汇总（阶段 6 起校验）",
          "$ref": "#/definitions/testSummary"
        },
        "systemTest": {
          "description": "系统测试执行汇总（阶段 7 起校验）",
          "$ref": "#/definitions/testSummary"
        },
        "acceptanceTest": {
          "description": "验收测试执行汇总（阶段 8 终检校验）",
          "$ref": "#/definitions/testSummary"
        }
      }
    }
  },
  "definitions": {
    "testSummary": {
      "description": "单级测试执行汇总对象（RTM 四级测试共用的结构单元）",
      "type": "object",
      "additionalProperties": false,
      "required": ["total", "passed", "failed", "pending", "coverage"],
      "properties": {
        "total": {
          "description": "该级测试用例总数，非负整数；passed+failed+pending 必须等于 total（违反被 count-invariant 校验拦截）",
          "type": "integer",
          "minimum": 0
        },
        "passed": {
          "description": "通过的测试数，非负整数",
          "type": "integer",
          "minimum": 0
        },
        "failed": {
          "description": "失败的测试数，非负整数",
          "type": "integer",
          "minimum": 0
        },
        "pending": {
          "description": "待执行/跳过的测试数，非负整数",
          "type": "integer",
          "minimum": 0
        },
        "coverage": {
          "description": "覆盖率百分比，取值 [0,100]（如 99.37 表示 99.37%）；单元测试覆盖率须 ≥80",
          "type": "number",
          "minimum": 0,
          "maximum": 100
        },
        "evidence": {
          "description": "本级测试结果的可验证运行证据（M07；阶段 5-8 当前层 total>0 时必需）。绑定真实测试命令、退出码与观测时间，可选携带原始输出文件路径与 SHA-256，使测试摘要不再是可随意填写的数字",
          "type": "object",
          "additionalProperties": false,
          "required": ["command", "exitCode", "observedAt"],
          "properties": {
            "command": {
              "description": "产生本次测试摘要的真实命令（不含未受控的 shell 管道/重定向；禁 ; & | < > 与换行）",
              "type": "string",
              "minLength": 1,
              "pattern": "^(?=.*\\S)(?!.*[;&|<>\\r\\n]).+$"
            },
            "exitCode": {
              "description": "真实进程退出码，非负整数；本字段是「测试结果与真实运行绑定」的锚点（有失败必须来自非零退出）",
              "type": "integer",
              "minimum": 0
            },
            "observedAt": {
              "description": "命令观测时间，UTC ISO-8601 毫秒精度（如 2026-09-15T10:00:00.000Z）",
              "type": "string",
              "format": "date-time",
              "pattern": "^\\d{4}-\\d{2}-\\d{2}T\\d{2}:\\d{2}:\\d{2}\\.\\d{3}Z$"
            },
            "rawOutputPath": {
              "description": "原始测试输出文件的仓库相对路径（可选；须与 rawOutputSha256 成对出现，且不得为绝对路径或越出仓库根）",
              "type": "string",
              "pattern": "^(?!/)(?![A-Za-z]:[\\\\/])(?!.*\\\\)(?!.*(?:^|/)\\.\\.(?:/|$))(?!.*//)(?!.*/$)(?!.*\\u0000).+$"
            },
            "rawOutputSha256": {
              "description": "原始测试输出文件的 SHA-256 十六进制摘要（可选；须与 rawOutputPath 成对出现，由门禁重新计算比对）",
              "type": "string",
              "pattern": "^[0-9a-f]{64}$"
            }
          }
        }
      }
    }
  }
}
