{
  "schemaVersion": "1.0",
  "projectId": "test-test-evidence",
  "currentPhase": 6,
  "lastUpdated": "2026-07-25T00:00:00+08:00",
  "rows": [
    {
      "requirementId": "REQ-001",
      "description": "用户登录",
      "designDoc": "SD-1.1",
      "codeModule": "SD-1.1:src/auth/login.ts:L1",
      "unitTest": "UT-001",
      "integrationTest": "IT-001",
      "systemTest": "ST-001",
      "acceptanceTest": "UAT-001",
      "coverageStatus": "100%"
    }
  ],
  "executionSummary": {
    "unitTest": {
      "total": 3,
      "passed": 3,
      "failed": 0,
      "pending": 0,
      "coverage": 92,
      "evidence": {
        "command": "npm run test:unit",
        "exitCode": 0,
        "observedAt": "2026-09-16T10:00:00.000Z"
      }
    },
    "integrationTest": {
      "total": 2,
      "passed": 2,
      "failed": 0,
      "pending": 0,
      "coverage": 100,
      "evidence": {
        "command": "npm run test:integration",
        "exitCode": 0,
        "observedAt": "2026-09-16T10:01:00.000Z"
      }
    },
    "systemTest": {
      "total": 2,
      "passed": 2,
      "failed": 0,
      "pending": 0,
      "coverage": 0,
      "evidence": {
        "command": "npm run test:system",
        "exitCode": 0,
        "observedAt": "2026-09-16T10:02:00.000Z"
      }
    },
    "acceptanceTest": {
      "total": 1,
      "passed": 1,
      "failed": 0,
      "pending": 0,
      "coverage": 0,
      "evidence": {
        "command": "npm run test:acceptance",
        "exitCode": 0,
        "observedAt": "2026-09-16T10:03:00.000Z"
      }
    }
  }
}
